commit	val_rmse	memory_gb	status	description
c349027	1.613147	0.0	discard	baseline MLP
b384912	1.519718	0.0	discard	11 per-metric tiny MLPs
03a4ef4	1.492304	0.0	discard	5-seed ensemble per-metric
c78eb4c	1.470466	0.0	discard	MSE loss instead of Huber
f70c7e5	1.361974	0.0	discard	patience=1000 eval_every=2
61e584c	1.329008	0.0	discard	patience=1000 eval_every=2 (fixed)
293a741	1.225061	0.0	discard	best-k ensemble (train 8 keep top 3)
eb4f14c	1.203087	0.0	discard	best-1 per metric (no ensemble)
ede9a1a	1.202650	0.0	keep	Huber(delta=2.0) training loss
74bafc5	1.199882	0.0	keep	Huber(delta=3.0) training loss
e35874a	1.199483	0.0	keep	Huber(delta=2.5) training loss
42b698a	1.199052	0.0	keep	AdamW with amsgrad=True
35db570	1.138032	0.0	keep	Xavier uniform weight initialization
95f0f64	1.134802	0.0	keep	hidden dim 48 with Xavier uniform
dd18e97	1.126009	0.0	keep	Huber delta=3.0 with Xavier+h48
2dd2a8e	1.117174	0.0	keep	weight decay 0.05
bbfffb6	1.107641	0.0	keep	linear shortcut (residual) connection
52dcd7a	1.106803	0.0	keep	WD=0.01
c9aee73	1.104091	0.0	keep	Huber delta=2.5 with shortcut+WD0.01
08b0982	1.329441	0.0	discard	patience=2000 (too slow; 6 metrics got 0 seeds)
ee3ded8	1.110272	0.0	discard	L1 (MAE) loss
b410eb6	1.133715	0.0	discard	SiLU activation instead of ReLU
e881225	1.727682	0.0	discard	sklearn Ridge regression with LOO alpha search
1248144	1.165593	0.0	discard	add velocity (frame diff) features
e87fbef	1.191064	0.0	discard	reduce aggregation to mean/std only (670 features)
ca91ab7	1.129754	0.0	discard	higher learning rate 3e-3
b8e0227	1.120906	0.0	discard	dropout 0.3 instead of 0.5
10d8d17	1.305091	0.0	discard	two hidden layers (48->16->1) with shortcut
6afab0b	1.234857	0.0	discard	Gaussian noise augmentation (std=0.1)
01502d3	0.959532	0.0	keep	12 seeds with patience=500 (faster turnover)
bef4255	0.929570	0.0	keep	16 seeds with patience=300
d4cc8bf	0.929268	0.0	keep	20 seeds with patience=200
c3c41c3	0.886836	0.0	keep	30 seeds with patience=150
29d36c7	0.962108	0.0	discard	50 seeds with patience=100
c6bc565	0.907396	0.0	discard	40 seeds with patience=120
bd68c3a	0.892193	0.0	discard	top-3 ensemble from 30 seeds
486814f	1.081137	0.0	discard	hidden_dim=32 with 30 seeds
82ee1a2	0.859473	0.0	keep	hidden_dim=64 with 30 seeds
649a40b	0.972742	0.0	discard	hidden_dim=80 with 30 seeds
9bad062	0.853730	0.0	keep	MSE training loss with h64 30 seeds
a0eb09b	0.853228	0.0	keep	weight decay 0.02 with MSE+h64
b3e9caa	0.853437	0.0	discard	weight decay 0.03
7cd347a	0.812270	0.0	keep	add median to aggregation (5 stats)
30f2e4d	0.599147	0.0	keep	add q25/q75 to aggregation (7 stats)
9a4d1bc	1.878670	0.9	keep	jun24 BASELINE existing model on 78 old samples (cached, full training)
9a4d1bc	1.688505	0.9	keep	jun24 deadlift OLD+NEW 152 samples (same code, +74 claude clips) -> -0.190 vs baseline, MORE DATA HELPS
9514e34	1.643407	0.9	keep	D1 hidden_dim 128 on 152 samples (-0.045 vs old+new)
9514e34	1.678815	0.9	discard	D2 hidden_dim 256 (worse than h128, revert)
9514e34	1.650443	0.9	discard	D3 dropout 0.3 (worse than d0.5, revert)
1f46743	1.601892	0.9	keep	D4 top-3 ensemble (h128) -0.042
1f46743	1.605491	0.9	discard	D5 top-5 ensemble (worse than top-3, revert)
1f46743	1.610936	0.9	discard	D6 weight_decay 0.01 (worse than 0.02, revert)
67f208f	1.599599	0.9	keep	D7 7-stat aggregation (simpler, -0.002)
d8183c6	1.567812	0.9	keep	D8 50 seeds + patience 100 (-0.032)
ac9ef70	1.550874	0.9	discard	D9 70 seeds + patience 80 (DEGENERATE: 5 metrics trained 0/70, fell back to mean; reverted)
7804650	1.631922	0.9	discard	D10 h64+top3+7stat (2 metrics untrained, still degenerate)
8667407	1.609103	0.9	keep	D11 patience 40 h64 top-3 7-stat - ALL 11 train (untrained=0), HONEST best -0.079 vs old+new
8667407	1.555389	0.9	discard	D12 60 seeds patience 40 (1 metric untrained, degenerate; revert to D11)
SQUAT-BASE	0.624933	0.9	keep	SQUAT BASELINE (fresh, no prior model) 57 samples, h64/30seeds/patience150/top1/9stat, untrained=0
00d77bb	0.538188	0.9	keep	S1 squat top-3 + patience 40 + 7-stat (-0.087, untrained=0)
6a4c645	0.536701	0.9	keep	S2 squat h128 (-0.0015, untrained=0)
6a4c645	0.538303	0.9	discard	S3 squat weight_decay 0.05 (worse than 0.02, revert)
6a4c645	0.574961	0.9	discard	S4 squat dropout 0.4 (worse than 0.5, revert)
45cd9d0	1.511618	0.0	keep	C2 per-metric Ridge (RidgeCV 5-fold, 7-stat, 152 samples) untrained=0 -- BEATS D11 1.6091 by -0.098
45cd9d0	1.529907	0.0	discard	C2 per-metric Lasso (worse than Ridge)
45cd9d0	1.533036	0.0	discard	C2 per-metric ElasticNet (worse than Ridge)
45cd9d0	1.533307	0.0	discard	C2 Ridge+SelectKBest(1000/300/600/100) all worse than full Ridge (feature selection hurts)
45cd9d0	1.510253	0.0	discard	C2 Ridge+PCA40 (1.5103 ~= full Ridge 1.5116, within noise; keep full Ridge for simplicity)
45cd9d0	1.499465	0.9	keep	C2 BLEND 0.7*Ridge + 0.3*NN-ensemble (7-stat) untrained=0 -- new deadlift best, beats D11 1.6091 by -0.110
5586665	0.529964	0.0	keep	C2 squat per-metric Ridge (7-stat) untrained=0 -- beats S2 0.5367 by -0.0067
5586665	0.565230	0.0	discard	C2 squat Lasso (worse than Ridge)
5586665	0.564347	0.0	discard	C2 squat ElasticNet (worse than Ridge)
5586665	0.489028	0.9	keep	C2 squat BLEND 0.5*Ridge + 0.5*NN-ensemble (h128, 7-stat) untrained=0 -- new squat best, beats S2 0.5367 by -0.048
7382132	1.527258	0.0	discard	C2 deadlift Ridge 9-stat (worse than 7-stat 1.5116; blend 1.499 still best)
7382132	0.523057	0.0	discard	C2 squat Ridge 9-stat (0.523 beats 7-stat ridge 0.530 but blend 0.489 still best)
dbe0517	1.643100	0.0	discard	C3 deadlift HGB standalone (overfits 122x2345; worse than Ridge 1.5116)
dbe0517	1.589600	0.0	discard	C3 deadlift ExtraTrees standalone (worse than Ridge, but diverse)
dbe0517	1.617100	0.0	discard	C3 deadlift kNN standalone (worse than Ridge, but diverse)
dbe0517	1.534469	0.0	discard	C3 deadlift per-metric 3-base convex stack (OOF-selected) -- with REDUCED NN; method sound but NN under-trained
dbe0517	1.543195	0.0	discard	C3 deadlift sklearn-stack ridge/ExtraTrees/kNN (OOF per-metric weights) -- WORSE than Ridge alone 1.5116; trees/kNN dont help
dbe0517	1.523890	0.0	discard	C3 deadlift stack+NN blend 1.5239 -- worse than C2 ridge+NN 1.4995; diverse learners + stacking dont beat 2-way
dbe0517	0.517800	0.0	note	C3 squat ExtraTrees standalone 0.5178 BEATS Ridge 0.5300 (note: candidate for blend)
dbe0517	0.529964	0.0	discard	C3 squat sklearn-stack collapsed to pure Ridge (OOF too conservative) -- = C2 blend 0.4890, no change
dbe0517	0.481293	0.0	discard	C3 squat Ridge+ExtraTrees avg + NN (0.4813; worse than pure ExtraTrees base)
dbe0517	0.475838	0.9	keep	C3 squat BASE-SWAP: ExtraTrees(0.5)+NN(0.5) blend = 0.4758 -- beats C2 Ridge+NN 0.4890 by -0.013 (ET 0.516 < Ridge 0.530 standalone justifies swap; flat min w0.4-0.5)
35939b0	0.475757	0.9	keep	C3 squat ExtraTrees+NN blend (W=0.5) verified in train_squat.py -- NEW SQUAT BEST, untrained=0
CLF-BASE	0.888889	0.0	note	CLASSIFIER LogReg C=1.0 acc=0.8889 mF1=0.8420 (3-class deadlift/squat/bench, 5-fold strat CV, 153 clips)
CLF-BEST	0.895425	0.0	keep	CLASSIFIER LogReg C=0.1 BEST acc=0.8954 mF1=0.8547; per-class F1 dl0.947/sq0.885/bench0.732; bench(22) is hard class
CLF-RF	0.817000	0.0	discard	CLASSIFIER RandomForest acc=0.8170 mF1=0.7067 (trees weak on 153x2345)
CLF-ET	0.823500	0.0	discard	CLASSIFIER ExtraTrees acc=0.8235 mF1=0.7496
CLF-MLP	0.836600	0.0	discard	CLASSIFIER MLP(64) acc=0.8366 mF1=0.7996
DL-V2	1.250320	0.9	keep	DEADLIFT v2 EXPANDED 360 samples (was 152): same Ridge+NN blend 1.2503 vs 1.499 (-0.249/-16.6pct). NN-only 1.193 now BEATS blend -- more data flips winner to unified NN (as unified_summary predicted).
SQ-V2	0.599156	0.9	note	SQUAT v2 EXPANDED 247 samples (was 57): val_rmse 0.599 vs 0.476. WORSE -- but original 57 all-clean formcheck, new ~190 all-noisy kinetics; val set now 4x larger + noisier (harder, more honest test). Config stale (tuned n=57); autoresearch re-tune may recover.
BENCH-V1	0.662099	0.9	keep	BENCH v1 FIRST REAL MODEL: 121 re-labeled clips (grounded rubric + full range). val_rmse 0.662 BEATS mean-baseline 0.766 by 13.6pct. Old labels were degenerate (all 5-6, baseline 0.24) = unbeatable mean-pred fake model; full-range re-label made bench learnable. NN0.694/ET0.790/blend0.662.
SQ-V3	1.039447	0.9	keep	SQUAT v3 RE-LABELED full-range (231 clips, grounded rubric): val_rmse 1.039 vs baseline 1.121 (beats 7.3pct). Labels spread std0.5->0.97; OLD 0.476 was near-mean-pred on degenerate labels. Now real model ~14pct var explained (old ~9pct). squatDepth 1.72 + inter-agent calib noise limit margin.
DL-V3	0.904620	0.9	keep	DEADLIFT v3 RE-LABELED-ONLY (275 consistent grounded-rubric clips, excl 78 old-convention originals): val_rmse 0.905 BEATS baseline 1.045 by 13.4pct. Mixed-dir (353 w/78 originals) FAILED 1.309>1.226 -- old+new label conventions conflict. Consistent labels = real model. NN-only 0.901.
